{
  "commitment_id": "red-unauth",
  "mapping_commitment": "sha256:13f78d37bdd04219fefb8de43e9a20a4cc3e07178283c0e3aba9f08dd291cbc7",
  "original_digest": "sha256:a8c22b58b2259efe287d5811699565977d8d15db2ea0009e5b7ffe406ecb4d69",
  "protected_location_class": "protected_store",
  "public_disclosure_class": "public_digests_only",
  "redacted_digest": "sha256:f74a5a61d43e529873db1803db6495d07f2399757315f02c654d7c05ccde718c",
  "redaction_manifest_digest": "sha256:beb445fc1a48a6309d8cdf2464fecf07295dc00c9d0228349ba259ebbdc94444",
  "redaction_service_id": "evil-redactor",
  "schema_version": "pip.RedactionCommitment.v1",
  "verification_result": "pass"
}
